{
  "kind" : "calendar#freeBusy" ,
  "timeMin" : "datetime" ,
  "timeMax" : "datetime" ,
  "groups" : {
    "(key)" : {
      "errors" : [
        {
          "domain" : "string" ,
          "reason" : "string"
        }
      ] ,
      "calendars" : [
        "string"
      ]
    }
  } ,
  "calendars" : {
    "(key)" : {
      "errors" : [
        {
          "domain" : "string" ,
          "reason" : "string"
        }
      ] ,
      "busy" : [
        {
          "start" : "datetime" ,
          "end" : "datetime"
        }
      ]
    }
  }
}